text,main_category,rating,verified_purchase,helpful_vote,category,ai_score
Why can you only use one at a time wanted to play Mario or Kirby or any old school game with my girlfriend but you can only use ONE AT A TIME WTF man you should put that in the product use when people are buying this a head up would be nice.,Computers,1.0,True,1,Video Games,0.0007508093850638886
Product came as expected. But Sony can do better. But you get what you pay for. I say wait till VR 2 comes out. Im sure the nausea will go away once its 60 fps and 1080 in each eye. Potential is there.,Video Games,3.0,True,0,Video Games,8.040783452401001e-05
It took me 120 hours to complete.  Lots of content!!  Where else can you get 120 hours of entertainment for 30 some odd dollars??  Great job! This game most have taken many log weeks and months to develop. My hats off to everyone involved!,Video Games,5.0,True,0,Video Games,0.0006890296936012952
"We had tried using backup battery packs to keep our Oculus Quest 2 operating for longer periods of time. It would tend to add too much weight for our kids and would not always hold a charge.<br />With this chord, we are able to play for longer periods of time while staying connected. If it starts to get annoying tripping over the chord from time to time, you can at least disconnect and have a few hours of charged play. The length is great because you can play in most rooms in our house with enough space where it does not get pulled from the wall outlets.",Cell Phones & Accessories,5.0,False,0,Video Games,0.002601207830965624
"This is an older game, but still a great one!  You can play offline by yourself against the computer, use lan to play with friends, or go online and play with countless others.  Great storyline as well.",Video Games,5.0,True,1,Video Games,0.0005590154769530287
"We love these guys. Everyone in my family has been playing Skylanders since Spyro's Adventure. So, we had to get these to add to our collection. These are definitely worth the price and you don't have to go around trying to find all the characters. I live in a smaller town and sometimes it is hard to find certain characters here locally. For instance, I still haven't seen Dr. Krankcase and he is my favorite out of the 5 pack.<br /><br />They come in a large box, but each character is in its own original box. So, you can wrap them individually if they are going to be a present.",Video Games,5.0,True,3,Video Games,99.99583195221861
"Indigo Prophecy is an awesome game/interactive movie. As I played I really began to care about the characters. The music and atmosphere are awesome. I only have a few minor complaints. My biggest problem was the left/right button mashing sequences toward the end. It was alright when they were spaced out but the back-to-back ones caused me no small amount of headaches. I got so fed up with this in the last sequence that I just stuck with the mediocre ending instead of trying to get the good one. Overall though, it was an awesome game.",Video Games,4.0,False,3,Video Games,8.44482614170694e-05
"Lamnetably i order this product thinking this game is better than NBA live, but i was wrong.<br />The 2K10 Menu is a disaster and disorder.<br />I can't buy or exchanged players, al least i do not find the options to do it.<br />Anyway, i played the game once and in two months i ain't touch the game again.<br /><br />Sincerely,<br /><br />Abdon Calderon",Video Games,1.0,True,0,Video Games,0.0016697394994991122
"My wife was jealous of my keyboard, so I got her a mechanical one as well. I didn't want to spend the money I spent on mine as she would not use many of it's features. I almost wish I had given her mine and gotten this for myself",Computers,5.0,True,0,Video Games,0.029346879039493512
"These are very cute and easy to put on. I just popped them inside out, then pushed them onto the joysticks. They do tend to end up tilted if I play for a long time, (meaning they rotate a little) but I don't really mind adjusting them when I'm done.",Video Games,5.0,True,0,Video Games,9.613652383055893e-05
I tried to like this game. I've played turn-based games before and this one is okay. Maybe I'm missing something but a tutorial or a display of stats would be helpful. Some things seem completely arbitrary - when my characters have traveled as far as they can or when certain troops should have won when they lost (or vice-versa.),Video Games,2.0,True,0,Video Games,0.00737693211804169
